root@lamp-s-1vcpu-1gb-tor1-01:~# tcpdump -i eth0 tcp
tcpdump: verbose output suppressed, use -v or -vv for full protocol decode
listening on eth0, link-type EN10MB (Ethernet), capture size 262144 bytes
20:12:07.494373 IP lamp-s-1vcpu-1gb-tor1-01.ssh > 198.96.85.163.2511: Flags [P.], seq 1890411002:1890411110, ack 1854538777, win 313, length 108
20:12:07.494484 IP lamp-s-1vcpu-1gb-tor1-01.ssh > 198.96.85.163.2511: Flags [P.], seq 108:144, ack 1, win 313, length 36
20:12:07.494594 IP lamp-s-1vcpu-1gb-tor1-01.ssh > 198.96.85.163.2511: Flags [P.], seq 144:252, ack 1, win 313, length 108
20:12:07.494671 IP lamp-s-1vcpu-1gb-tor1-01.ssh > 198.96.85.163.2511: Flags [P.], seq 252:288, ack 1, win 313, length 36
20:12:07.496630 IP lamp-s-1vcpu-1gb-tor1-01.ssh > 198.96.85.163.2511: Flags [P.], seq 288:468, ack 1, win 313, length 180
20:12:07.496738 IP lamp-s-1vcpu-1gb-tor1-01.ssh > 198.96.85.163.2511: Flags [P.], seq 468:504, ack 1, win 313, length 36
20:12:07.496852 IP lamp-s-1vcpu-1gb-tor1-01.ssh > 198.96.85.163.2511: Flags [P.], seq 504:660, ack 1, win 313, length 156
20:12:07.496933 IP lamp-s-1vcpu-1gb-tor1-01.ssh > 198.96.85.163.2511: Flags [P.], seq 660:696, ack 1, win 313, length 36
20:12:07.497038 IP lamp-s-1vcpu-1gb-tor1-01.ssh > 198.96.85.163.2511: Flags [P.], seq 696:852, ack 1, win 313, length 156
20:12:07.497296 IP lamp-s-1vcpu-1gb-tor1-01.ssh > 198.96.85.163.2511: Flags [P.], seq 888:1044, ack 1, win 313, length 156
20:12:07.497499 IP lamp-s-1vcpu-1gb-tor1-01.ssh > 198.96.85.163.2511: Flags [P.], seq 1080:1236, ack 1, win 313, length 156
20:12:07.497665 IP lamp-s-1vcpu-1gb-tor1-01.ssh > 198.96.85.163.2511: Flags [P.], seq 1272:1428, ack 1, win 313, length 156
20:12:07.497824 IP lamp-s-1vcpu-1gb-tor1-01.ssh > 198.96.85.163.2511: Flags [P.], seq 1464:1620, ack 1, win 313, length 156
20:12:07.498009 IP lamp-s-1vcpu-1gb-tor1-01.ssh > 198.96.85.163.2511: Flags [P.], seq 1656:1812, ack 1, win 313, length 156
20:12:07.500175 IP 198.96.85.163.2511 > lamp-s-1vcpu-1gb-tor1-01.ssh: Flags [.], ack 696, win 4535, length 0
20:12:07.500213 IP lamp-s-1vcpu-1gb-tor1-01.ssh > 198.96.85.163.2511: Flags [P.], seq 1812:3032, ack 1, win 313, length 1220
20:12:07.500357 IP lamp-s-1vcpu-1gb-tor1-01.ssh > 198.96.85.163.2511: Flags [P.], seq 3032:3180, ack 1, win 313, length 148
20:12:07.500474 IP lamp-s-1vcpu-1gb-tor1-01.ssh > 198.96.85.163.2511: Flags [P.], seq 3180:3216, ack 1, win 313, length 36
20:12:07.500582 IP lamp-s-1vcpu-1gb-tor1-01.ssh > 198.96.85.163.2511: Flags [P.], seq 3216:3380, ack 1, win 313, length 164
20:12:07.500656 IP lamp-s-1vcpu-1gb-tor1-01.ssh > 198.96.85.163.2511: Flags [P.], seq 3380:3416, ack 1, win 313, length 36
20:12:07.500751 IP lamp-s-1vcpu-1gb-tor1-01.ssh > 198.96.85.163.2511: Flags [P.], seq 3416:3580, ack 1, win 313, length 164
20:12:07.500823 IP lamp-s-1vcpu-1gb-tor1-01.ssh > 198.96.85.163.2511: Flags [P.], seq 3580:3616, ack 1, win 313, length 36
20:12:07.500917 IP lamp-s-1vcpu-1gb-tor1-01.ssh > 198.96.85.163.2511: Flags [P.], seq 3616:3772, ack 1, win 313, length 156
20:12:07.501021 IP 198.96.85.163.2511 > lamp-s-1vcpu-1gb-tor1-01.ssh: Flags [.], ack 1812, win 4539, length 0
20:12:07.501047 IP lamp-s-1vcpu-1gb-tor1-01.ssh > 198.96.85.163.2511: Flags [P.], seq 3772:3808, ack 1, win 313, length 36
20:12:07.501296 IP lamp-s-1vcpu-1gb-tor1-01.ssh > 198.96.85.163.2511: Flags [P.], seq 4008:4164, ack 1, win 313, length 156
20:12:07.501462 IP lamp-s-1vcpu-1gb-tor1-01.ssh > 198.96.85.163.2511: Flags [P.], seq 4200:4364, ack 1, win 313, length 164
20:12:07.501625 IP lamp-s-1vcpu-1gb-tor1-01.ssh > 198.96.85.163.2511: Flags [P.], seq 4400:4556, ack 1, win 313, length 156
20:12:07.501788 IP lamp-s-1vcpu-1gb-tor1-01.ssh > 198.96.85.163.2511: Flags [P.], seq 4592:4756, ack 1, win 313, length 164
20:12:07.501951 IP lamp-s-1vcpu-1gb-tor1-01.ssh > 198.96.85.163.2511: Flags [P.], seq 4792:4940, ack 1, win 313, length 148
20:12:07.502128 IP lamp-s-1vcpu-1gb-tor1-01.ssh > 198.96.85.163.2511: Flags [P.], seq 4976:5132, ack 1, win 313, length 156
20:12:07.502305 IP lamp-s-1vcpu-1gb-tor1-01.ssh > 198.96.85.163.2511: Flags [P.], seq 5168:5332, ack 1, win 313, length 164
20:12:07.502469 IP lamp-s-1vcpu-1gb-tor1-01.ssh > 198.96.85.163.2511: Flags [P.], seq 5368:5532, ack 1, win 313, length 164
20:12:07.502636 IP lamp-s-1vcpu-1gb-tor1-01.ssh > 198.96.85.163.2511: Flags [P.], seq 5568:5732, ack 1, win 313, length 164
20:12:07.502808 IP lamp-s-1vcpu-1gb-tor1-01.ssh > 198.96.85.163.2511: Flags [P.], seq 5768:5932, ack 1, win 313, length 164
20:12:07.505516 IP 198.96.85.163.2511 > lamp-s-1vcpu-1gb-tor1-01.ssh: Flags [.], ack 5368, win 4539, length 0
20:12:07.505560 IP lamp-s-1vcpu-1gb-tor1-01.ssh > 198.96.85.163.2511: Flags [P.], seq 5932:7168, ack 1, win 313, length 1236
20:12:07.505585 IP 198.96.85.163.2511 > lamp-s-1vcpu-1gb-tor1-01.ssh: Flags [.], ack 5932, win 4537, length 0
20:12:07.505720 IP lamp-s-1vcpu-1gb-tor1-01.ssh > 198.96.85.163.2511: Flags [P.], seq 7168:7316, ack 1, win 313, length 148
20:12:07.505805 IP lamp-s-1vcpu-1gb-tor1-01.ssh > 198.96.85.163.2511: Flags [P.], seq 7316:7352, ack 1, win 313, length 36
20:12:07.505908 IP lamp-s-1vcpu-1gb-tor1-01.ssh > 198.96.85.163.2511: Flags [P.], seq 7352:7516, ack 1, win 313, length 164
20:12:07.505981 IP lamp-s-1vcpu-1gb-tor1-01.ssh > 198.96.85.163.2511: Flags [P.], seq 7516:7552, ack 1, win 313, length 36
20:12:07.506075 IP lamp-s-1vcpu-1gb-tor1-01.ssh > 198.96.85.163.2511: Flags [P.], seq 7552:7700, ack 1, win 313, length 148
20:12:07.506146 IP lamp-s-1vcpu-1gb-tor1-01.ssh > 198.96.85.163.2511: Flags [P.], seq 7700:7736, ack 1, win 313, length 36
20:12:07.506242 IP lamp-s-1vcpu-1gb-tor1-01.ssh > 198.96.85.163.2511: Flags [P.], seq 7736:7900, ack 1, win 313, length 164
20:12:07.506408 IP lamp-s-1vcpu-1gb-tor1-01.ssh > 198.96.85.163.2511: Flags [P.], seq 7936:8092, ack 1, win 313, length 156
20:12:07.506571 IP lamp-s-1vcpu-1gb-tor1-01.ssh > 198.96.85.163.2511: Flags [P.], seq 8128:8292, ack 1, win 313, length 164
20:12:07.506673 IP lamp-s-1vcpu-1gb-tor1-01.ssh > 198.96.85.163.2511: Flags [P.], seq 8292:8456, ack 1, win 313, length 164
20:12:07.506837 IP lamp-s-1vcpu-1gb-tor1-01.ssh > 198.96.85.163.2511: Flags [P.], seq 8456:8996, ack 1, win 313, length 540
20:12:07.506994 IP lamp-s-1vcpu-1gb-tor1-01.ssh > 198.96.85.163.2511: Flags [P.], seq 8996:9408, ack 1, win 313, length 412
20:12:07.507108 IP lamp-s-1vcpu-1gb-tor1-01.ssh > 198.96.85.163.2511: Flags [P.], seq 9408:9572, ack 1, win 313, length 164
20:12:07.507221 IP lamp-s-1vcpu-1gb-tor1-01.ssh > 198.96.85.163.2511: Flags [P.], seq 9572:9736, ack 1, win 313, length 164
20:12:07.507328 IP lamp-s-1vcpu-1gb-tor1-01.ssh > 198.96.85.163.2511: Flags [P.], seq 9736:9900, ack 1, win 313, length 164
20:12:07.507432 IP lamp-s-1vcpu-1gb-tor1-01.ssh > 198.96.85.163.2511: Flags [P.], seq 9900:10064, ack 1, win 313, length 164
20:12:07.507536 IP lamp-s-1vcpu-1gb-tor1-01.ssh > 198.96.85.163.2511: Flags [P.], seq 10064:10228, ack 1, win 313, length 164
20:12:07.507640 IP lamp-s-1vcpu-1gb-tor1-01.ssh > 198.96.85.163.2511: Flags [P.], seq 10228:10392, ack 1, win 313, length 164
20:12:07.507793 IP lamp-s-1vcpu-1gb-tor1-01.ssh > 198.96.85.163.2511: Flags [P.], seq 10392:10556, ack 1, win 313, length 164
20:12:07.507913 IP lamp-s-1vcpu-1gb-tor1-01.ssh > 198.96.85.163.2511: Flags [P.], seq 10556:10720, ack 1, win 313, length 164
20:12:07.508020 IP lamp-s-1vcpu-1gb-tor1-01.ssh > 198.96.85.163.2511: Flags [P.], seq 10720:10884, ack 1, win 313, length 164
20:12:07.508125 IP lamp-s-1vcpu-1gb-tor1-01.ssh > 198.96.85.163.2511: Flags [P.], seq 10884:11048, ack 1, win 313, length 164
20:12:07.508230 IP lamp-s-1vcpu-1gb-tor1-01.ssh > 198.96.85.163.2511: Flags [P.], seq 11048:11212, ack 1, win 313, length 164
20:12:07.508336 IP lamp-s-1vcpu-1gb-tor1-01.ssh > 198.96.85.163.2511: Flags [P.], seq 11212:11376, ack 1, win 313, length 164
20:12:07.508479 IP lamp-s-1vcpu-1gb-tor1-01.ssh > 198.96.85.163.2511: Flags [P.], seq 11376:11540, ack 1, win 313, length 164
20:12:07.508592 IP lamp-s-1vcpu-1gb-tor1-01.ssh > 198.96.85.163.2511: Flags [P.], seq 11540:11704, ack 1, win 313, length 164
20:12:07.508700 IP lamp-s-1vcpu-1gb-tor1-01.ssh > 198.96.85.163.2511: Flags [P.], seq 11704:11868, ack 1, win 313, length 164
20:12:07.508807 IP lamp-s-1vcpu-1gb-tor1-01.ssh > 198.96.85.163.2511: Flags [P.], seq 11868:12032, ack 1, win 313, length 164
20:12:07.508914 IP lamp-s-1vcpu-1gb-tor1-01.ssh > 198.96.85.163.2511: Flags [P.], seq 12032:12196, ack 1, win 313, length 164
20:12:07.509019 IP lamp-s-1vcpu-1gb-tor1-01.ssh > 198.96.85.163.2511: Flags [P.], seq 12196:12360, ack 1, win 313, length 164
20:12:07.509125 IP lamp-s-1vcpu-1gb-tor1-01.ssh > 198.96.85.163.2511: Flags [P.], seq 12360:12524, ack 1, win 313, length 164
20:12:07.509266 IP lamp-s-1vcpu-1gb-tor1-01.ssh > 198.96.85.163.2511: Flags [P.], seq 12524:12688, ack 1, win 313, length 164
20:12:07.509408 IP lamp-s-1vcpu-1gb-tor1-01.ssh > 198.96.85.163.2511: Flags [P.], seq 12688:12852, ack 1, win 313, length 164
20:12:07.509519 IP lamp-s-1vcpu-1gb-tor1-01.ssh > 198.96.85.163.2511: Flags [P.], seq 12852:13016, ack 1, win 313, length 164
20:12:07.509626 IP lamp-s-1vcpu-1gb-tor1-01.ssh > 198.96.85.163.2511: Flags [P.], seq 13016:13180, ack 1, win 313, length 164
20:12:07.509733 IP lamp-s-1vcpu-1gb-tor1-01.ssh > 198.96.85.163.2511: Flags [P.], seq 13180:13344, ack 1, win 313, length 164
20:12:07.509847 IP 198.96.85.163.2511 > lamp-s-1vcpu-1gb-tor1-01.ssh: Flags [.], ack 8292, win 4539, length 0
20:12:07.509936 IP lamp-s-1vcpu-1gb-tor1-01.ssh > 198.96.85.163.2511: Flags [P.], seq 13344:13508, ack 1, win 313, length 164
20:12:07.510049 IP lamp-s-1vcpu-1gb-tor1-01.ssh > 198.96.85.163.2511: Flags [P.], seq 13508:13784, ack 1, win 313, length 276
20:12:07.510160 IP lamp-s-1vcpu-1gb-tor1-01.ssh > 198.96.85.163.2511: Flags [P.], seq 13784:13948, ack 1, win 313, length 164
20:12:07.510264 IP lamp-s-1vcpu-1gb-tor1-01.ssh > 198.96.85.163.2511: Flags [P.], seq 13948:14112, ack 1, win 313, length 164
20:12:07.510367 IP lamp-s-1vcpu-1gb-tor1-01.ssh > 198.96.85.163.2511: Flags [P.], seq 14112:14276, ack 1, win 313, length 164
20:12:07.510499 IP lamp-s-1vcpu-1gb-tor1-01.ssh > 198.96.85.163.2511: Flags [P.], seq 14276:14440, ack 1, win 313, length 164
20:12:07.510590 IP 198.96.85.163.2511 > lamp-s-1vcpu-1gb-tor1-01.ssh: Flags [.], ack 10064, win 4539, length 0
20:12:07.510609 IP 198.96.85.163.2511 > lamp-s-1vcpu-1gb-tor1-01.ssh: Flags [.], ack 10556, win 4537, length 0
20:12:07.510721 IP lamp-s-1vcpu-1gb-tor1-01.ssh > 198.96.85.163.2511: Flags [P.], seq 14440:14828, ack 1, win 313, length 388
20:12:07.510831 IP lamp-s-1vcpu-1gb-tor1-01.ssh > 198.96.85.163.2511: Flags [P.], seq 14828:14992, ack 1, win 313, length 164
20:12:07.510934 IP lamp-s-1vcpu-1gb-tor1-01.ssh > 198.96.85.163.2511: Flags [P.], seq 14992:15156, ack 1, win 313, length 164
20:12:07.511037 IP lamp-s-1vcpu-1gb-tor1-01.ssh > 198.96.85.163.2511: Flags [P.], seq 15156:15320, ack 1, win 313, length 164
20:12:07.511138 IP lamp-s-1vcpu-1gb-tor1-01.ssh > 198.96.85.163.2511: Flags [P.], seq 15320:15484, ack 1, win 313, length 164
20:12:07.511240 IP lamp-s-1vcpu-1gb-tor1-01.ssh > 198.96.85.163.2511: Flags [P.], seq 15484:15648, ack 1, win 313, length 164
20:12:07.511342 IP lamp-s-1vcpu-1gb-tor1-01.ssh > 198.96.85.163.2511: Flags [P.], seq 15648:15812, ack 1, win 313, length 164
20:12:07.511443 IP lamp-s-1vcpu-1gb-tor1-01.ssh > 198.96.85.163.2511: Flags [P.], seq 15812:15976, ack 1, win 313, length 164
20:12:07.511545 IP lamp-s-1vcpu-1gb-tor1-01.ssh > 198.96.85.163.2511: Flags [P.], seq 15976:16140, ack 1, win 313, length 164
20:12:07.511647 IP lamp-s-1vcpu-1gb-tor1-01.ssh > 198.96.85.163.2511: Flags [P.], seq 16140:16304, ack 1, win 313, length 164
20:12:07.511782 IP lamp-s-1vcpu-1gb-tor1-01.ssh > 198.96.85.163.2511: Flags [P.], seq 16304:16468, ack 1, win 313, length 164
20:12:07.511890 IP lamp-s-1vcpu-1gb-tor1-01.ssh > 198.96.85.163.2511: Flags [P.], seq 16468:16632, ack 1, win 313, length 164
20:12:07.511992 IP lamp-s-1vcpu-1gb-tor1-01.ssh > 198.96.85.163.2511: Flags [P.], seq 16632:16796, ack 1, win 313, length 164
20:12:07.512101 IP lamp-s-1vcpu-1gb-tor1-01.ssh > 198.96.85.163.2511: Flags [P.], seq 16796:16960, ack 1, win 313, length 164
20:12:07.512203 IP lamp-s-1vcpu-1gb-tor1-01.ssh > 198.96.85.163.2511: Flags [P.], seq 16960:17124, ack 1, win 313, length 164
20:12:07.512304 IP lamp-s-1vcpu-1gb-tor1-01.ssh > 198.96.85.163.2511: Flags [P.], seq 17124:17288, ack 1, win 313, length 164
20:12:07.512455 IP lamp-s-1vcpu-1gb-tor1-01.ssh > 198.96.85.163.2511: Flags [P.], seq 17288:17452, ack 1, win 313, length 164
20:12:07.512573 IP lamp-s-1vcpu-1gb-tor1-01.ssh > 198.96.85.163.2511: Flags [P.], seq 17452:17616, ack 1, win 313, length 164
20:12:07.512678 IP lamp-s-1vcpu-1gb-tor1-01.ssh > 198.96.85.163.2511: Flags [P.], seq 17616:17780, ack 1, win 313, length 164
20:12:07.512780 IP lamp-s-1vcpu-1gb-tor1-01.ssh > 198.96.85.163.2511: Flags [P.], seq 17780:17944, ack 1, win 313, length 164
20:12:07.512876 IP 198.96.85.163.2511 > lamp-s-1vcpu-1gb-tor1-01.ssh: Flags [.], ack 11704, win 4539, length 0
20:12:07.512977 IP lamp-s-1vcpu-1gb-tor1-01.ssh > 198.96.85.163.2511: Flags [P.], seq 17944:18108, ack 1, win 313, length 164
20:12:07.513076 IP lamp-s-1vcpu-1gb-tor1-01.ssh > 198.96.85.163.2511: Flags [P.], seq 18108:18256, ack 1, win 313, length 148
20:12:07.513172 IP lamp-s-1vcpu-1gb-tor1-01.ssh > 198.96.85.163.2511: Flags [P.], seq 18256:18420, ack 1, win 313, length 164
20:12:07.513320 IP lamp-s-1vcpu-1gb-tor1-01.ssh > 198.96.85.163.2511: Flags [P.], seq 18420:18584, ack 1, win 313, length 164
20:12:07.513427 IP lamp-s-1vcpu-1gb-tor1-01.ssh > 198.96.85.163.2511: Flags [P.], seq 18584:18748, ack 1, win 313, length 164
20:12:07.513537 IP lamp-s-1vcpu-1gb-tor1-01.ssh > 198.96.85.163.2511: Flags [P.], seq 18748:18912, ack 1, win 313, length 164
20:12:07.513631 IP lamp-s-1vcpu-1gb-tor1-01.ssh > 198.96.85.163.2511: Flags [P.], seq 18912:19076, ack 1, win 313, length 164
20:12:07.513724 IP lamp-s-1vcpu-1gb-tor1-01.ssh > 198.96.85.163.2511: Flags [P.], seq 19076:19240, ack 1, win 313, length 164
20:12:07.513817 IP lamp-s-1vcpu-1gb-tor1-01.ssh > 198.96.85.163.2511: Flags [P.], seq 19240:19404, ack 1, win 313, length 164
20:12:07.513911 IP lamp-s-1vcpu-1gb-tor1-01.ssh > 198.96.85.163.2511: Flags [P.], seq 19404:19568, ack 1, win 313, length 164
20:12:07.514004 IP lamp-s-1vcpu-1gb-tor1-01.ssh > 198.96.85.163.2511: Flags [P.], seq 19568:19732, ack 1, win 313, length 164
20:12:07.514098 IP lamp-s-1vcpu-1gb-tor1-01.ssh > 198.96.85.163.2511: Flags [P.], seq 19732:19896, ack 1, win 313, length 164
20:12:07.514192 IP lamp-s-1vcpu-1gb-tor1-01.ssh > 198.96.85.163.2511: Flags [P.], seq 19896:20060, ack 1, win 313, length 164
20:12:07.514290 IP lamp-s-1vcpu-1gb-tor1-01.ssh > 198.96.85.163.2511: Flags [P.], seq 20060:20224, ack 1, win 313, length 164
20:12:07.514383 IP lamp-s-1vcpu-1gb-tor1-01.ssh > 198.96.85.163.2511: Flags [P.], seq 20224:20388, ack 1, win 313, length 164
20:12:07.514425 IP lamp-s-1vcpu-1gb-tor1-01.ssh > 198.96.85.163.2511: Flags [P.], seq 20388:20552, ack 1, win 313, length 164
20:12:07.514548 IP lamp-s-1vcpu-1gb-tor1-01.ssh > 198.96.85.163.2511: Flags [P.], seq 20552:20844, ack 1, win 313, length 292
20:12:07.514654 IP lamp-s-1vcpu-1gb-tor1-01.ssh > 198.96.85.163.2511: Flags [P.], seq 20844:21008, ack 1, win 313, length 164
20:12:07.514761 IP lamp-s-1vcpu-1gb-tor1-01.ssh > 198.96.85.163.2511: Flags [P.], seq 21008:21172, ack 1, win 313, length 164
20:12:07.514865 IP lamp-s-1vcpu-1gb-tor1-01.ssh > 198.96.85.163.2511: Flags [P.], seq 21172:21336, ack 1, win 313, length 164
20:12:07.514968 IP lamp-s-1vcpu-1gb-tor1-01.ssh > 198.96.85.163.2511: Flags [P.], seq 21336:21500, ack 1, win 313, length 164
20:12:07.515074 IP lamp-s-1vcpu-1gb-tor1-01.ssh > 198.96.85.163.2511: Flags [P.], seq 21500:21664, ack 1, win 313, length 164
20:12:07.515174 IP lamp-s-1vcpu-1gb-tor1-01.ssh > 198.96.85.163.2511: Flags [P.], seq 21664:21828, ack 1, win 313, length 164
20:12:07.515277 IP lamp-s-1vcpu-1gb-tor1-01.ssh > 198.96.85.163.2511: Flags [P.], seq 21828:21992, ack 1, win 313, length 164
20:12:07.515379 IP lamp-s-1vcpu-1gb-tor1-01.ssh > 198.96.85.163.2511: Flags [P.], seq 21992:22156, ack 1, win 313, length 164
20:12:07.515482 IP lamp-s-1vcpu-1gb-tor1-01.ssh > 198.96.85.163.2511: Flags [P.], seq 22156:22320, ack 1, win 313, length 164
20:12:07.515585 IP lamp-s-1vcpu-1gb-tor1-01.ssh > 198.96.85.163.2511: Flags [P.], seq 22320:22484, ack 1, win 313, length 164
20:12:07.515689 IP lamp-s-1vcpu-1gb-tor1-01.ssh > 198.96.85.163.2511: Flags [P.], seq 22484:22648, ack 1, win 313, length 164
20:12:07.515822 IP lamp-s-1vcpu-1gb-tor1-01.ssh > 198.96.85.163.2511: Flags [P.], seq 22648:22812, ack 1, win 313, length 164
20:12:07.515926 IP lamp-s-1vcpu-1gb-tor1-01.ssh > 198.96.85.163.2511: Flags [P.], seq 22812:22976, ack 1, win 313, length 164
20:12:07.516027 IP lamp-s-1vcpu-1gb-tor1-01.ssh > 198.96.85.163.2511: Flags [P.], seq 22976:23140, ack 1, win 313, length 164
20:12:07.516129 IP lamp-s-1vcpu-1gb-tor1-01.ssh > 198.96.85.163.2511: Flags [P.], seq 23140:23304, ack 1, win 313, length 164
20:12:07.516232 IP lamp-s-1vcpu-1gb-tor1-01.ssh > 198.96.85.163.2511: Flags [P.], seq 23304:23468, ack 1, win 313, length 164
20:12:07.516334 IP lamp-s-1vcpu-1gb-tor1-01.ssh > 198.96.85.163.2511: Flags [P.], seq 23468:23632, ack 1, win 313, length 164
20:12:07.516460 IP lamp-s-1vcpu-1gb-tor1-01.ssh > 198.96.85.163.2511: Flags [P.], seq 23632:23796, ack 1, win 313, length 164
20:12:07.516566 IP lamp-s-1vcpu-1gb-tor1-01.ssh > 198.96.85.163.2511: Flags [P.], seq 23796:23960, ack 1, win 313, length 164
20:12:07.516606 IP 198.96.85.163.2511 > lamp-s-1vcpu-1gb-tor1-01.ssh: Flags [.], ack 17288, win 4539, length 0
20:12:07.516748 IP lamp-s-1vcpu-1gb-tor1-01.ssh > 198.96.85.163.2511: Flags [P.], seq 23960:24236, ack 1, win 313, length 276
20:12:07.516863 IP lamp-s-1vcpu-1gb-tor1-01.ssh > 198.96.85.163.2511: Flags [P.], seq 24236:24400, ack 1, win 313, length 164
20:12:07.516967 IP lamp-s-1vcpu-1gb-tor1-01.ssh > 198.96.85.163.2511: Flags [P.], seq 24400:24564, ack 1, win 313, length 164
20:12:07.517069 IP lamp-s-1vcpu-1gb-tor1-01.ssh > 198.96.85.163.2511: Flags [P.], seq 24564:24728, ack 1, win 313, length 164
20:12:07.517170 IP lamp-s-1vcpu-1gb-tor1-01.ssh > 198.96.85.163.2511: Flags [P.], seq 24728:24892, ack 1, win 313, length 164
20:12:07.517213 IP 198.96.85.163.2511 > lamp-s-1vcpu-1gb-tor1-01.ssh: Flags [.], ack 17780, win 4537, length 0
20:12:07.517294 IP 198.96.85.163.2511 > lamp-s-1vcpu-1gb-tor1-01.ssh: Flags [.], ack 19732, win 4539, length 0
20:12:07.517414 IP lamp-s-1vcpu-1gb-tor1-01.ssh > 198.96.85.163.2511: Flags [P.], seq 24892:25280, ack 1, win 313, length 388
20:12:07.517526 IP lamp-s-1vcpu-1gb-tor1-01.ssh > 198.96.85.163.2511: Flags [P.], seq 25280:25444, ack 1, win 313, length 164
20:12:07.517630 IP lamp-s-1vcpu-1gb-tor1-01.ssh > 198.96.85.163.2511: Flags [P.], seq 25444:25608, ack 1, win 313, length 164
20:12:07.517732 IP lamp-s-1vcpu-1gb-tor1-01.ssh > 198.96.85.163.2511: Flags [P.], seq 25608:25772, ack 1, win 313, length 164
20:12:07.517835 IP lamp-s-1vcpu-1gb-tor1-01.ssh > 198.96.85.163.2511: Flags [P.], seq 25772:25936, ack 1, win 313, length 164
20:12:07.517936 IP lamp-s-1vcpu-1gb-tor1-01.ssh > 198.96.85.163.2511: Flags [P.], seq 25936:26100, ack 1, win 313, length 164
20:12:07.518036 IP lamp-s-1vcpu-1gb-tor1-01.ssh > 198.96.85.163.2511: Flags [P.], seq 26100:26264, ack 1, win 313, length 164
20:12:07.518137 IP lamp-s-1vcpu-1gb-tor1-01.ssh > 198.96.85.163.2511: Flags [P.], seq 26264:26428, ack 1, win 313, length 164
20:12:07.518237 IP lamp-s-1vcpu-1gb-tor1-01.ssh > 198.96.85.163.2511: Flags [P.], seq 26428:26592, ack 1, win 313, length 164
20:12:07.518339 IP lamp-s-1vcpu-1gb-tor1-01.ssh > 198.96.85.163.2511: Flags [P.], seq 26592:26756, ack 1, win 313, length 164
20:12:07.518441 IP lamp-s-1vcpu-1gb-tor1-01.ssh > 198.96.85.163.2511: Flags [P.], seq 26756:26920, ack 1, win 313, length 164
20:12:07.518542 IP lamp-s-1vcpu-1gb-tor1-01.ssh > 198.96.85.163.2511: Flags [P.], seq 26920:27084, ack 1, win 313, length 164
20:12:07.518643 IP lamp-s-1vcpu-1gb-tor1-01.ssh > 198.96.85.163.2511: Flags [P.], seq 27084:27248, ack 1, win 313, length 164
20:12:07.518745 IP lamp-s-1vcpu-1gb-tor1-01.ssh > 198.96.85.163.2511: Flags [P.], seq 27248:27412, ack 1, win 313, length 164
20:12:07.518847 IP lamp-s-1vcpu-1gb-tor1-01.ssh > 198.96.85.163.2511: Flags [P.], seq 27412:27576, ack 1, win 313, length 164
20:12:07.518953 IP lamp-s-1vcpu-1gb-tor1-01.ssh > 198.96.85.163.2511: Flags [P.], seq 27576:27740, ack 1, win 313, length 164
20:12:07.519057 IP lamp-s-1vcpu-1gb-tor1-01.ssh > 198.96.85.163.2511: Flags [P.], seq 27740:27904, ack 1, win 313, length 164
20:12:07.519158 IP lamp-s-1vcpu-1gb-tor1-01.ssh > 198.96.85.163.2511: Flags [P.], seq 27904:28068, ack 1, win 313, length 164
20:12:07.519259 IP lamp-s-1vcpu-1gb-tor1-01.ssh > 198.96.85.163.2511: Flags [P.], seq 28068:28232, ack 1, win 313, length 164
20:12:07.519360 IP lamp-s-1vcpu-1gb-tor1-01.ssh > 198.96.85.163.2511: Flags [P.], seq 28232:28396, ack 1, win 313, length 164
20:12:07.519462 IP lamp-s-1vcpu-1gb-tor1-01.ssh > 198.96.85.163.2511: Flags [P.], seq 28396:28560, ack 1, win 313, length 164
20:12:07.519565 IP lamp-s-1vcpu-1gb-tor1-01.ssh > 198.96.85.163.2511: Flags [P.], seq 28560:28724, ack 1, win 313, length 164
20:12:07.519667 IP lamp-s-1vcpu-1gb-tor1-01.ssh > 198.96.85.163.2511: Flags [P.], seq 28724:28888, ack 1, win 313, length 164
20:12:07.519804 IP lamp-s-1vcpu-1gb-tor1-01.ssh > 198.96.85.163.2511: Flags [P.], seq 28888:29052, ack 1, win 313, length 164
20:12:07.519914 IP lamp-s-1vcpu-1gb-tor1-01.ssh > 198.96.85.163.2511: Flags [P.], seq 29052:29216, ack 1, win 313, length 164
20:12:07.520018 IP lamp-s-1vcpu-1gb-tor1-01.ssh > 198.96.85.163.2511: Flags [P.], seq 29216:29380, ack 1, win 313, length 164
20:12:07.520120 IP lamp-s-1vcpu-1gb-tor1-01.ssh > 198.96.85.163.2511: Flags [P.], seq 29380:29544, ack 1, win 313, length 164
20:12:07.520222 IP lamp-s-1vcpu-1gb-tor1-01.ssh > 198.96.85.163.2511: Flags [P.], seq 29544:29708, ack 1, win 313, length 164
20:12:07.520324 IP lamp-s-1vcpu-1gb-tor1-01.ssh > 198.96.85.163.2511: Flags [P.], seq 29708:29872, ack 1, win 313, length 164
20:12:07.520446 IP lamp-s-1vcpu-1gb-tor1-01.ssh > 198.96.85.163.2511: Flags [P.], seq 29872:30036, ack 1, win 313, length 164
20:12:07.520552 IP lamp-s-1vcpu-1gb-tor1-01.ssh > 198.96.85.163.2511: Flags [P.], seq 30036:30200, ack 1, win 313, length 164
20:12:07.520657 IP lamp-s-1vcpu-1gb-tor1-01.ssh > 198.96.85.163.2511: Flags [P.], seq 30200:30364, ack 1, win 313, length 164
20:12:07.520747 IP 198.96.85.163.2511 > lamp-s-1vcpu-1gb-tor1-01.ssh: Flags [.], ack 24892, win 4539, length 0
20:12:07.520859 IP lamp-s-1vcpu-1gb-tor1-01.ssh > 198.96.85.163.2511: Flags [P.], seq 30364:30640, ack 1, win 313, length 276
20:12:07.520942 IP 198.96.85.163.2511 > lamp-s-1vcpu-1gb-tor1-01.ssh: Flags [P.], seq 1:37, ack 24892, win 4539, length 36
^C
183 packets captured
202 packets received by filter
19 packets dropped by kernel
