root@lamp-s-1vcpu-1gb-tor1-01:~# tcpdump -i eth0
tcpdump: verbose output suppressed, use -v or -vv for full protocol decode
listening on eth0, link-type EN10MB (Ethernet), capture size 262144 bytes
19:55:38.815489 IP lamp-s-1vcpu-1gb-tor1-01.ssh > 198.96.85.163.2511: Flags [P.], seq 1876609126:1876609234, ack 1854518169, win 292, length 108
19:55:38.815600 IP lamp-s-1vcpu-1gb-tor1-01.ssh > 198.96.85.163.2511: Flags [P.], seq 108:144, ack 1, win 292, length 36
19:55:38.815768 IP lamp-s-1vcpu-1gb-tor1-01.ssh > 198.96.85.163.2511: Flags [P.], seq 144:252, ack 1, win 292, length 108
19:55:38.815898 IP lamp-s-1vcpu-1gb-tor1-01.ssh > 198.96.85.163.2511: Flags [P.], seq 252:288, ack 1, win 292, length 36
19:55:38.818060 IP lamp-s-1vcpu-1gb-tor1-01.ssh > 198.96.85.163.2511: Flags [P.], seq 288:468, ack 1, win 292, length 180
19:55:38.818160 IP lamp-s-1vcpu-1gb-tor1-01.ssh > 198.96.85.163.2511: Flags [P.], seq 468:504, ack 1, win 292, length 36
19:55:38.821643 IP 198.96.85.163.2511 > lamp-s-1vcpu-1gb-tor1-01.ssh: Flags [.], ack 504, win 512, length 0
19:55:38.821693 IP lamp-s-1vcpu-1gb-tor1-01.ssh > 198.96.85.163.2511: Flags [P.], seq 504:1464, ack 1, win 292, length 960
19:55:38.821841 IP lamp-s-1vcpu-1gb-tor1-01.ssh > 198.96.85.163.2511: Flags [P.], seq 1464:1612, ack 1, win 292, length 148
19:55:38.821943 IP lamp-s-1vcpu-1gb-tor1-01.ssh > 198.96.85.163.2511: Flags [P.], seq 1612:1648, ack 1, win 292, length 36
19:55:38.822069 IP lamp-s-1vcpu-1gb-tor1-01.ssh > 198.96.85.163.2511: Flags [P.], seq 1648:1804, ack 1, win 292, length 156
19:55:38.822178 IP lamp-s-1vcpu-1gb-tor1-01.ssh > 198.96.85.163.2511: Flags [P.], seq 1804:1840, ack 1, win 292, length 36
19:55:38.822294 IP lamp-s-1vcpu-1gb-tor1-01.ssh > 198.96.85.163.2511: Flags [P.], seq 1840:2004, ack 1, win 292, length 164
19:55:38.822372 IP lamp-s-1vcpu-1gb-tor1-01.ssh > 198.96.85.163.2511: Flags [P.], seq 2004:2040, ack 1, win 292, length 36
19:55:38.822474 IP lamp-s-1vcpu-1gb-tor1-01.ssh > 198.96.85.163.2511: Flags [P.], seq 2040:2196, ack 1, win 292, length 156
19:55:38.855612 IP 198.96.85.163.2511 > lamp-s-1vcpu-1gb-tor1-01.ssh: Flags [.], ack 2196, win 512, length 0
19:55:38.855676 IP lamp-s-1vcpu-1gb-tor1-01.ssh > 198.96.85.163.2511: Flags [P.], seq 2196:3216, ack 1, win 292, length 1020
19:55:38.855891 IP lamp-s-1vcpu-1gb-tor1-01.ssh > 198.96.85.163.2511: Flags [P.], seq 3216:3364, ack 1, win 292, length 148
19:55:38.856000 IP lamp-s-1vcpu-1gb-tor1-01.ssh > 198.96.85.163.2511: Flags [P.], seq 3364:3400, ack 1, win 292, length 36
19:55:38.856141 IP lamp-s-1vcpu-1gb-tor1-01.ssh > 198.96.85.163.2511: Flags [P.], seq 3400:3564, ack 1, win 292, length 164
19:55:38.856241 IP lamp-s-1vcpu-1gb-tor1-01.ssh > 198.96.85.163.2511: Flags [P.], seq 3564:3600, ack 1, win 292, length 36
19:55:38.856378 IP lamp-s-1vcpu-1gb-tor1-01.ssh > 198.96.85.163.2511: Flags [P.], seq 3600:3764, ack 1, win 292, length 164
19:55:38.856539 IP lamp-s-1vcpu-1gb-tor1-01.ssh > 198.96.85.163.2511: Flags [P.], seq 3764:3800, ack 1, win 292, length 36
19:55:38.856762 IP lamp-s-1vcpu-1gb-tor1-01.ssh > 198.96.85.163.2511: Flags [P.], seq 3800:3956, ack 1, win 292, length 156
19:55:38.869321 IP 198.96.85.163.2511 > lamp-s-1vcpu-1gb-tor1-01.ssh: Flags [.], ack 3956, win 512, length 0
19:55:38.869366 IP lamp-s-1vcpu-1gb-tor1-01.ssh > 198.96.85.163.2511: Flags [P.], seq 3956:4976, ack 1, win 292, length 1020
19:55:38.869541 IP lamp-s-1vcpu-1gb-tor1-01.ssh > 198.96.85.163.2511: Flags [P.], seq 4976:5124, ack 1, win 292, length 148
19:55:38.869638 IP lamp-s-1vcpu-1gb-tor1-01.ssh > 198.96.85.163.2511: Flags [P.], seq 5124:5160, ack 1, win 292, length 36
19:55:38.869751 IP lamp-s-1vcpu-1gb-tor1-01.ssh > 198.96.85.163.2511: Flags [P.], seq 5160:5324, ack 1, win 292, length 164
19:55:38.869857 IP lamp-s-1vcpu-1gb-tor1-01.ssh > 198.96.85.163.2511: Flags [P.], seq 5324:5360, ack 1, win 292, length 36
19:55:38.870022 IP lamp-s-1vcpu-1gb-tor1-01.ssh > 198.96.85.163.2511: Flags [P.], seq 5360:5524, ack 1, win 292, length 164
19:55:38.870109 IP lamp-s-1vcpu-1gb-tor1-01.ssh > 198.96.85.163.2511: Flags [P.], seq 5524:5560, ack 1, win 292, length 36
19:55:38.870216 IP lamp-s-1vcpu-1gb-tor1-01.ssh > 198.96.85.163.2511: Flags [P.], seq 5560:5716, ack 1, win 292, length 156
^C
33 packets captured
34 packets received by filter
0 packets dropped by kernel
