root@lamp-s-1vcpu-1gb-tor1-01:~# tcpdump -n -i eth0
tcpdump: verbose output suppressed, use -v or -vv for full protocol decode
listening on eth0, link-type EN10MB (Ethernet), capture size 262144 bytes
20:10:22.381770 IP 159.203.13.170.22 > 198.96.85.163.2511: Flags [P.], seq 1889859390:1889859498, ack 1854536433, win 313, length 108
20:10:22.381912 IP 159.203.13.170.22 > 198.96.85.163.2511: Flags [P.], seq 108:144, ack 1, win 313, length 36
20:10:22.382019 IP 159.203.13.170.22 > 198.96.85.163.2511: Flags [P.], seq 144:252, ack 1, win 313, length 108
20:10:22.382093 IP 159.203.13.170.22 > 198.96.85.163.2511: Flags [P.], seq 252:288, ack 1, win 313, length 36
20:10:22.382345 IP 159.203.13.170.22 > 198.96.85.163.2511: Flags [P.], seq 288:460, ack 1, win 313, length 172
20:10:22.382444 IP 159.203.13.170.22 > 198.96.85.163.2511: Flags [P.], seq 460:496, ack 1, win 313, length 36
20:10:22.382570 IP 159.203.13.170.22 > 198.96.85.163.2511: Flags [P.], seq 496:644, ack 1, win 313, length 148
20:10:22.382672 IP 159.203.13.170.22 > 198.96.85.163.2511: Flags [P.], seq 644:680, ack 1, win 313, length 36
20:10:22.382787 IP 159.203.13.170.22 > 198.96.85.163.2511: Flags [P.], seq 680:828, ack 1, win 313, length 148
20:10:22.385554 IP 198.96.85.163.2511 > 159.203.13.170.22: Flags [.], ack 288, win 4536, length 0
20:10:22.385612 IP 159.203.13.170.22 > 198.96.85.163.2511: Flags [P.], seq 828:1968, ack 1, win 313, length 1140
20:10:22.385637 IP 198.96.85.163.2511 > 159.203.13.170.22: Flags [.], ack 828, win 4539, length 0
20:10:22.385784 IP 159.203.13.170.22 > 198.96.85.163.2511: Flags [P.], seq 1968:2100, ack 1, win 313, length 132
20:10:22.385887 IP 159.203.13.170.22 > 198.96.85.163.2511: Flags [P.], seq 2100:2136, ack 1, win 313, length 36
20:10:22.386019 IP 159.203.13.170.22 > 198.96.85.163.2511: Flags [P.], seq 2136:2284, ack 1, win 313, length 148
20:10:22.386096 IP 159.203.13.170.22 > 198.96.85.163.2511: Flags [P.], seq 2284:2320, ack 1, win 313, length 36
20:10:22.386215 IP 159.203.13.170.22 > 198.96.85.163.2511: Flags [P.], seq 2320:2452, ack 1, win 313, length 132
20:10:22.386294 IP 159.203.13.170.22 > 198.96.85.163.2511: Flags [P.], seq 2452:2488, ack 1, win 313, length 36
20:10:22.386393 IP 159.203.13.170.22 > 198.96.85.163.2511: Flags [P.], seq 2488:2636, ack 1, win 313, length 148
20:10:22.386600 IP 159.203.13.170.22 > 198.96.85.163.2511: Flags [P.], seq 2672:2820, ack 1, win 313, length 148
20:10:22.386800 IP 159.203.13.170.22 > 198.96.85.163.2511: Flags [P.], seq 2856:3004, ack 1, win 313, length 148
20:10:22.386989 IP 159.203.13.170.22 > 198.96.85.163.2511: Flags [P.], seq 3040:3188, ack 1, win 313, length 148
20:10:22.387175 IP 159.203.13.170.22 > 198.96.85.163.2511: Flags [P.], seq 3224:3372, ack 1, win 313, length 148
20:10:22.387360 IP 159.203.13.170.22 > 198.96.85.163.2511: Flags [P.], seq 3408:3556, ack 1, win 313, length 148
20:10:22.387574 IP 159.203.13.170.22 > 198.96.85.163.2511: Flags [P.], seq 3592:3740, ack 1, win 313, length 148
20:10:22.389586 IP 198.96.85.163.2511 > 159.203.13.170.22: Flags [.], ack 2320, win 4539, length 0
20:10:22.389622 IP 159.203.13.170.22 > 198.96.85.163.2511: Flags [P.], seq 3740:4880, ack 1, win 313, length 1140
20:10:22.389754 IP 159.203.13.170.22 > 198.96.85.163.2511: Flags [P.], seq 4880:5012, ack 1, win 313, length 132
20:10:22.389858 IP 159.203.13.170.22 > 198.96.85.163.2511: Flags [P.], seq 5012:5048, ack 1, win 313, length 36
20:10:22.389965 IP 159.203.13.170.22 > 198.96.85.163.2511: Flags [P.], seq 5048:5196, ack 1, win 313, length 148
20:10:22.390039 IP 159.203.13.170.22 > 198.96.85.163.2511: Flags [P.], seq 5196:5232, ack 1, win 313, length 36
20:10:22.390135 IP 159.203.13.170.22 > 198.96.85.163.2511: Flags [P.], seq 5232:5380, ack 1, win 313, length 148
20:10:22.390209 IP 159.203.13.170.22 > 198.96.85.163.2511: Flags [P.], seq 5380:5416, ack 1, win 313, length 36
20:10:22.390318 IP 159.203.13.170.22 > 198.96.85.163.2511: Flags [P.], seq 5416:5564, ack 1, win 313, length 148
20:10:22.390402 IP 159.203.13.170.22 > 198.96.85.163.2511: Flags [P.], seq 5564:5600, ack 1, win 313, length 36
20:10:22.390505 IP 159.203.13.170.22 > 198.96.85.163.2511: Flags [P.], seq 5600:5748, ack 1, win 313, length 148
20:10:22.390750 IP 159.203.13.170.22 > 198.96.85.163.2511: Flags [P.], seq 5784:5932, ack 1, win 313, length 148
20:10:22.390919 IP 159.203.13.170.22 > 198.96.85.163.2511: Flags [P.], seq 5968:6116, ack 1, win 313, length 148
20:10:22.391108 IP 159.203.13.170.22 > 198.96.85.163.2511: Flags [P.], seq 6152:6300, ack 1, win 313, length 148
20:10:22.391288 IP 159.203.13.170.22 > 198.96.85.163.2511: Flags [P.], seq 6336:6484, ack 1, win 313, length 148
20:10:22.391474 IP 159.203.13.170.22 > 198.96.85.163.2511: Flags [P.], seq 6520:6668, ack 1, win 313, length 148
20:10:22.391768 IP 159.203.13.170.22 > 198.96.85.163.2511: Flags [P.], seq 6704:6852, ack 1, win 313, length 148
20:10:22.392004 IP 159.203.13.170.22 > 198.96.85.163.2511: Flags [P.], seq 6852:7576, ack 1, win 313, length 724
20:10:22.392148 IP 159.203.13.170.22 > 198.96.85.163.2511: Flags [P.], seq 7576:7732, ack 1, win 313, length 156
20:10:22.392287 IP 159.203.13.170.22 > 198.96.85.163.2511: Flags [P.], seq 7732:7880, ack 1, win 313, length 148
20:10:22.392459 IP 159.203.13.170.22 > 198.96.85.163.2511: Flags [P.], seq 7880:8028, ack 1, win 313, length 148
20:10:22.392619 IP 159.203.13.170.22 > 198.96.85.163.2511: Flags [P.], seq 8028:8176, ack 1, win 313, length 148
20:10:22.392776 IP 159.203.13.170.22 > 198.96.85.163.2511: Flags [P.], seq 8176:8324, ack 1, win 313, length 148
20:10:22.392940 IP 159.203.13.170.22 > 198.96.85.163.2511: Flags [P.], seq 8324:8472, ack 1, win 313, length 148
20:10:22.393085 IP 159.203.13.170.22 > 198.96.85.163.2511: Flags [P.], seq 8472:8620, ack 1, win 313, length 148
20:10:22.393205 IP 159.203.13.170.22 > 198.96.85.163.2511: Flags [P.], seq 8620:8768, ack 1, win 313, length 148
20:10:22.393882 IP 159.203.13.170.22 > 198.96.85.163.2511: Flags [P.], seq 8768:8916, ack 1, win 313, length 148
20:10:22.394028 IP 159.203.13.170.22 > 198.96.85.163.2511: Flags [P.], seq 8916:9064, ack 1, win 313, length 148
20:10:22.394166 IP 159.203.13.170.22 > 198.96.85.163.2511: Flags [P.], seq 9064:9212, ack 1, win 313, length 148
20:10:22.394295 IP 159.203.13.170.22 > 198.96.85.163.2511: Flags [P.], seq 9212:9360, ack 1, win 313, length 148
20:10:22.394411 IP 159.203.13.170.22 > 198.96.85.163.2511: Flags [P.], seq 9360:9508, ack 1, win 313, length 148
20:10:22.394523 IP 159.203.13.170.22 > 198.96.85.163.2511: Flags [P.], seq 9508:9656, ack 1, win 313, length 148
20:10:22.394651 IP 159.203.13.170.22 > 198.96.85.163.2511: Flags [P.], seq 9656:9804, ack 1, win 313, length 148
20:10:22.394791 IP 159.203.13.170.22 > 198.96.85.163.2511: Flags [P.], seq 9804:9952, ack 1, win 313, length 148
20:10:22.394923 IP 159.203.13.170.22 > 198.96.85.163.2511: Flags [P.], seq 9952:10100, ack 1, win 313, length 148
20:10:22.455804 IP 159.203.13.170.22 > 198.96.85.163.2511: Flags [P.], seq 10100:10256, ack 1, win 313, length 156
20:10:22.464703 IP 198.96.85.163.2511 > 159.203.13.170.22: Flags [.], ack 5380, win 4539, length 0
20:10:22.464761 IP 159.203.13.170.22 > 198.96.85.163.2511: Flags [P.], seq 10256:10412, ack 1, win 313, length 156
20:10:22.464791 IP 198.96.85.163.2511 > 159.203.13.170.22: Flags [.], ack 8176, win 4539, length 0
20:10:22.464813 IP 198.96.85.163.2511 > 159.203.13.170.22: Flags [.], ack 10256, win 4539, length 0
20:10:22.465058 IP 159.203.13.170.22 > 198.96.85.163.2511: Flags [P.], seq 10412:10864, ack 1, win 313, length 452
20:10:22.465150 IP 198.96.85.163.2511 > 159.203.13.170.22: Flags [P.], seq 1:37, ack 10256, win 4539, length 36
20:10:22.465340 IP 159.203.13.170.22 > 198.96.85.163.2511: Flags [P.], seq 10864:11132, ack 37, win 313, length 268
20:10:22.465485 IP 159.203.13.170.22 > 198.96.85.163.2511: Flags [P.], seq 11132:11288, ack 37, win 313, length 156
20:10:22.465601 IP 159.203.13.170.22 > 198.96.85.163.2511: Flags [P.], seq 11288:11444, ack 37, win 313, length 156
20:10:22.465720 IP 159.203.13.170.22 > 198.96.85.163.2511: Flags [P.], seq 11444:11600, ack 37, win 313, length 156
20:10:22.465832 IP 159.203.13.170.22 > 198.96.85.163.2511: Flags [P.], seq 11600:11756, ack 37, win 313, length 156
20:10:22.465971 IP 159.203.13.170.22 > 198.96.85.163.2511: Flags [P.], seq 11756:11912, ack 37, win 313, length 156
20:10:22.466021 IP 198.96.85.163.2511 > 159.203.13.170.22: Flags [P.], seq 37:73, ack 10256, win 4539, length 36
^C
74 packets captured
87 packets received by filter
13 packets dropped by kernel
