root@lamp-s-1vcpu-1gb-tor1-01:~# tcpdump -i eth0 src 159.203.13.170
tcpdump: verbose output suppressed, use -v or -vv for full protocol decode
listening on eth0, link-type EN10MB (Ethernet), capture size 262144 bytes
20:15:50.112109 IP lamp-s-1vcpu-1gb-tor1-01.ssh > 198.96.85.163.2511: Flags [P.], seq 1891444402:1891444510, ack 1854542653, win 313, length 108
20:15:50.112219 IP lamp-s-1vcpu-1gb-tor1-01.ssh > 198.96.85.163.2511: Flags [P.], seq 108:144, ack 1, win 313, length 36
20:15:50.112321 IP lamp-s-1vcpu-1gb-tor1-01.ssh > 198.96.85.163.2511: Flags [P.], seq 144:252, ack 1, win 313, length 108
20:15:50.112435 IP lamp-s-1vcpu-1gb-tor1-01.ssh > 198.96.85.163.2511: Flags [P.], seq 252:288, ack 1, win 313, length 36
20:15:50.114459 IP lamp-s-1vcpu-1gb-tor1-01.ssh > 198.96.85.163.2511: Flags [P.], seq 288:468, ack 1, win 313, length 180
20:15:50.114565 IP lamp-s-1vcpu-1gb-tor1-01.ssh > 198.96.85.163.2511: Flags [P.], seq 468:504, ack 1, win 313, length 36
20:15:50.114684 IP lamp-s-1vcpu-1gb-tor1-01.ssh > 198.96.85.163.2511: Flags [P.], seq 504:660, ack 1, win 313, length 156
20:15:50.114768 IP lamp-s-1vcpu-1gb-tor1-01.ssh > 198.96.85.163.2511: Flags [P.], seq 660:696, ack 1, win 313, length 36
20:15:50.114877 IP lamp-s-1vcpu-1gb-tor1-01.ssh > 198.96.85.163.2511: Flags [P.], seq 696:852, ack 1, win 313, length 156
20:15:50.115762 IP lamp-s-1vcpu-1gb-tor1-01.ssh > 198.96.85.163.2511: Flags [P.], seq 852:2040, ack 1, win 313, length 1188
20:15:50.115943 IP lamp-s-1vcpu-1gb-tor1-01.ssh > 198.96.85.163.2511: Flags [P.], seq 2040:2204, ack 1, win 313, length 164
20:15:50.116033 IP lamp-s-1vcpu-1gb-tor1-01.ssh > 198.96.85.163.2511: Flags [P.], seq 2204:2240, ack 1, win 313, length 36
20:15:50.116137 IP lamp-s-1vcpu-1gb-tor1-01.ssh > 198.96.85.163.2511: Flags [P.], seq 2240:2404, ack 1, win 313, length 164
20:15:50.116233 IP lamp-s-1vcpu-1gb-tor1-01.ssh > 198.96.85.163.2511: Flags [P.], seq 2404:2440, ack 1, win 313, length 36
20:15:50.116337 IP lamp-s-1vcpu-1gb-tor1-01.ssh > 198.96.85.163.2511: Flags [P.], seq 2440:2596, ack 1, win 313, length 156
20:15:50.116443 IP lamp-s-1vcpu-1gb-tor1-01.ssh > 198.96.85.163.2511: Flags [P.], seq 2596:2632, ack 1, win 313, length 36
20:15:50.116560 IP lamp-s-1vcpu-1gb-tor1-01.ssh > 198.96.85.163.2511: Flags [P.], seq 2632:2796, ack 1, win 313, length 164
20:15:50.116640 IP lamp-s-1vcpu-1gb-tor1-01.ssh > 198.96.85.163.2511: Flags [P.], seq 2796:2832, ack 1, win 313, length 36
20:15:50.116741 IP lamp-s-1vcpu-1gb-tor1-01.ssh > 198.96.85.163.2511: Flags [P.], seq 2832:2988, ack 1, win 313, length 156
20:15:50.117740 IP lamp-s-1vcpu-1gb-tor1-01.ssh > 198.96.85.163.2511: Flags [P.], seq 2988:4008, ack 1, win 313, length 1020
20:15:50.117893 IP lamp-s-1vcpu-1gb-tor1-01.ssh > 198.96.85.163.2511: Flags [P.], seq 4008:4172, ack 1, win 313, length 164
20:15:50.118040 IP lamp-s-1vcpu-1gb-tor1-01.ssh > 198.96.85.163.2511: Flags [P.], seq 4172:4208, ack 1, win 313, length 36
20:15:50.118253 IP lamp-s-1vcpu-1gb-tor1-01.ssh > 198.96.85.163.2511: Flags [P.], seq 4208:4372, ack 1, win 313, length 164
20:15:50.118394 IP lamp-s-1vcpu-1gb-tor1-01.ssh > 198.96.85.163.2511: Flags [P.], seq 4372:4408, ack 1, win 313, length 36
20:15:50.118569 IP lamp-s-1vcpu-1gb-tor1-01.ssh > 198.96.85.163.2511: Flags [P.], seq 4408:4564, ack 1, win 313, length 156
20:15:50.118716 IP lamp-s-1vcpu-1gb-tor1-01.ssh > 198.96.85.163.2511: Flags [P.], seq 4564:4600, ack 1, win 313, length 36
20:15:50.118892 IP lamp-s-1vcpu-1gb-tor1-01.ssh > 198.96.85.163.2511: Flags [P.], seq 4600:4764, ack 1, win 313, length 164
20:15:50.119036 IP lamp-s-1vcpu-1gb-tor1-01.ssh > 198.96.85.163.2511: Flags [P.], seq 4764:4800, ack 1, win 313, length 36
20:15:50.119165 IP lamp-s-1vcpu-1gb-tor1-01.ssh > 198.96.85.163.2511: Flags [P.], seq 4800:4956, ack 1, win 313, length 156
20:15:50.119985 IP lamp-s-1vcpu-1gb-tor1-01.ssh > 198.96.85.163.2511: Flags [P.], seq 4956:5976, ack 1, win 313, length 1020
20:15:50.120195 IP lamp-s-1vcpu-1gb-tor1-01.ssh > 198.96.85.163.2511: Flags [P.], seq 5976:6140, ack 1, win 313, length 164
20:15:50.120344 IP lamp-s-1vcpu-1gb-tor1-01.ssh > 198.96.85.163.2511: Flags [P.], seq 6140:6176, ack 1, win 313, length 36
20:15:50.120572 IP lamp-s-1vcpu-1gb-tor1-01.ssh > 198.96.85.163.2511: Flags [P.], seq 6176:6340, ack 1, win 313, length 164
20:15:50.120670 IP lamp-s-1vcpu-1gb-tor1-01.ssh > 198.96.85.163.2511: Flags [P.], seq 6340:6376, ack 1, win 313, length 36
20:15:50.120781 IP lamp-s-1vcpu-1gb-tor1-01.ssh > 198.96.85.163.2511: Flags [P.], seq 6376:6532, ack 1, win 313, length 156
20:15:50.120860 IP lamp-s-1vcpu-1gb-tor1-01.ssh > 198.96.85.163.2511: Flags [P.], seq 6532:6568, ack 1, win 313, length 36
20:15:50.120964 IP lamp-s-1vcpu-1gb-tor1-01.ssh > 198.96.85.163.2511: Flags [P.], seq 6568:6732, ack 1, win 313, length 164
20:15:50.121041 IP lamp-s-1vcpu-1gb-tor1-01.ssh > 198.96.85.163.2511: Flags [P.], seq 6732:6768, ack 1, win 313, length 36
20:15:50.121143 IP lamp-s-1vcpu-1gb-tor1-01.ssh > 198.96.85.163.2511: Flags [P.], seq 6768:6924, ack 1, win 313, length 156
20:15:50.121220 IP lamp-s-1vcpu-1gb-tor1-01.ssh > 198.96.85.163.2511: Flags [P.], seq 6924:6960, ack 1, win 313, length 36
20:15:50.121322 IP lamp-s-1vcpu-1gb-tor1-01.ssh > 198.96.85.163.2511: Flags [P.], seq 6960:7124, ack 1, win 313, length 164
20:15:50.121527 IP lamp-s-1vcpu-1gb-tor1-01.ssh > 198.96.85.163.2511: Flags [P.], seq 7160:7316, ack 1, win 313, length 156
20:15:50.121747 IP lamp-s-1vcpu-1gb-tor1-01.ssh > 198.96.85.163.2511: Flags [P.], seq 7316:7600, ack 1, win 313, length 284
20:15:50.121953 IP lamp-s-1vcpu-1gb-tor1-01.ssh > 198.96.85.163.2511: Flags [P.], seq 7600:8260, ack 1, win 313, length 660
20:15:50.122099 IP lamp-s-1vcpu-1gb-tor1-01.ssh > 198.96.85.163.2511: Flags [P.], seq 8260:8424, ack 1, win 313, length 164
20:15:50.122225 IP lamp-s-1vcpu-1gb-tor1-01.ssh > 198.96.85.163.2511: Flags [P.], seq 8424:8588, ack 1, win 313, length 164
20:15:50.122343 IP lamp-s-1vcpu-1gb-tor1-01.ssh > 198.96.85.163.2511: Flags [P.], seq 8588:8752, ack 1, win 313, length 164
20:15:50.122462 IP lamp-s-1vcpu-1gb-tor1-01.ssh > 198.96.85.163.2511: Flags [P.], seq 8752:8916, ack 1, win 313, length 164
20:15:50.148006 IP lamp-s-1vcpu-1gb-tor1-01.ssh > 198.96.85.163.2511: Flags [P.], seq 8916:9080, ack 1, win 313, length 164
20:15:50.148259 IP lamp-s-1vcpu-1gb-tor1-01.ssh > 198.96.85.163.2511: Flags [P.], seq 9080:9244, ack 1, win 313, length 164
20:15:50.148434 IP lamp-s-1vcpu-1gb-tor1-01.ssh > 198.96.85.163.2511: Flags [P.], seq 9244:9408, ack 1, win 313, length 164
20:15:50.148582 IP lamp-s-1vcpu-1gb-tor1-01.ssh > 198.96.85.163.2511: Flags [P.], seq 9408:9572, ack 1, win 313, length 164
20:15:50.148704 IP lamp-s-1vcpu-1gb-tor1-01.ssh > 198.96.85.163.2511: Flags [P.], seq 9572:9736, ack 1, win 313, length 164
20:15:50.148884 IP lamp-s-1vcpu-1gb-tor1-01.ssh > 198.96.85.163.2511: Flags [P.], seq 9736:9900, ack 1, win 313, length 164
20:15:50.149036 IP lamp-s-1vcpu-1gb-tor1-01.ssh > 198.96.85.163.2511: Flags [P.], seq 9900:10064, ack 1, win 313, length 164
20:15:50.149234 IP lamp-s-1vcpu-1gb-tor1-01.ssh > 198.96.85.163.2511: Flags [P.], seq 10064:10228, ack 1, win 313, length 164
20:15:50.149463 IP lamp-s-1vcpu-1gb-tor1-01.ssh > 198.96.85.163.2511: Flags [P.], seq 10228:10392, ack 1, win 313, length 164
20:15:50.149677 IP lamp-s-1vcpu-1gb-tor1-01.ssh > 198.96.85.163.2511: Flags [P.], seq 10392:10556, ack 1, win 313, length 164
20:15:50.149903 IP lamp-s-1vcpu-1gb-tor1-01.ssh > 198.96.85.163.2511: Flags [P.], seq 10556:10720, ack 1, win 313, length 164
20:15:50.150074 IP lamp-s-1vcpu-1gb-tor1-01.ssh > 198.96.85.163.2511: Flags [P.], seq 10720:10884, ack 1, win 313, length 164
20:15:50.150202 IP lamp-s-1vcpu-1gb-tor1-01.ssh > 198.96.85.163.2511: Flags [P.], seq 10884:11048, ack 1, win 313, length 164
20:15:50.150321 IP lamp-s-1vcpu-1gb-tor1-01.ssh > 198.96.85.163.2511: Flags [P.], seq 11048:11212, ack 1, win 313, length 164
20:15:50.150436 IP lamp-s-1vcpu-1gb-tor1-01.ssh > 198.96.85.163.2511: Flags [P.], seq 11212:11376, ack 1, win 313, length 164
20:15:50.150600 IP lamp-s-1vcpu-1gb-tor1-01.ssh > 198.96.85.163.2511: Flags [P.], seq 11376:11540, ack 1, win 313, length 164
20:15:50.150736 IP lamp-s-1vcpu-1gb-tor1-01.ssh > 198.96.85.163.2511: Flags [P.], seq 11540:11704, ack 1, win 313, length 164
20:15:50.150892 IP lamp-s-1vcpu-1gb-tor1-01.ssh > 198.96.85.163.2511: Flags [P.], seq 11704:11868, ack 1, win 313, length 164
20:15:50.151059 IP lamp-s-1vcpu-1gb-tor1-01.ssh > 198.96.85.163.2511: Flags [P.], seq 11868:12032, ack 1, win 313, length 164
20:15:50.151206 IP lamp-s-1vcpu-1gb-tor1-01.ssh > 198.96.85.163.2511: Flags [P.], seq 12032:12196, ack 1, win 313, length 164
20:15:50.151325 IP lamp-s-1vcpu-1gb-tor1-01.ssh > 198.96.85.163.2511: Flags [P.], seq 12196:12360, ack 1, win 313, length 164
20:15:50.151439 IP lamp-s-1vcpu-1gb-tor1-01.ssh > 198.96.85.163.2511: Flags [P.], seq 12360:12524, ack 1, win 313, length 164
20:15:50.151552 IP lamp-s-1vcpu-1gb-tor1-01.ssh > 198.96.85.163.2511: Flags [P.], seq 12524:12688, ack 1, win 313, length 164
20:15:50.151665 IP lamp-s-1vcpu-1gb-tor1-01.ssh > 198.96.85.163.2511: Flags [P.], seq 12688:12852, ack 1, win 313, length 164
20:15:50.151824 IP lamp-s-1vcpu-1gb-tor1-01.ssh > 198.96.85.163.2511: Flags [P.], seq 12852:13016, ack 1, win 313, length 164
20:15:50.151947 IP lamp-s-1vcpu-1gb-tor1-01.ssh > 198.96.85.163.2511: Flags [P.], seq 13016:13180, ack 1, win 313, length 164
20:15:50.152063 IP lamp-s-1vcpu-1gb-tor1-01.ssh > 198.96.85.163.2511: Flags [P.], seq 13180:13344, ack 1, win 313, length 164
20:15:50.152175 IP lamp-s-1vcpu-1gb-tor1-01.ssh > 198.96.85.163.2511: Flags [P.], seq 13344:13508, ack 1, win 313, length 164
20:15:50.152288 IP lamp-s-1vcpu-1gb-tor1-01.ssh > 198.96.85.163.2511: Flags [P.], seq 13508:13672, ack 1, win 313, length 164
20:15:50.152428 IP lamp-s-1vcpu-1gb-tor1-01.ssh > 198.96.85.163.2511: Flags [P.], seq 13672:13836, ack 1, win 313, length 164
20:15:50.152547 IP lamp-s-1vcpu-1gb-tor1-01.ssh > 198.96.85.163.2511: Flags [P.], seq 13836:14000, ack 1, win 313, length 164
20:15:50.152712 IP lamp-s-1vcpu-1gb-tor1-01.ssh > 198.96.85.163.2511: Flags [P.], seq 14000:14164, ack 1, win 313, length 164
20:15:50.152834 IP lamp-s-1vcpu-1gb-tor1-01.ssh > 198.96.85.163.2511: Flags [P.], seq 14164:14328, ack 1, win 313, length 164
20:15:50.152949 IP lamp-s-1vcpu-1gb-tor1-01.ssh > 198.96.85.163.2511: Flags [P.], seq 14328:14492, ack 1, win 313, length 164
20:15:50.153062 IP lamp-s-1vcpu-1gb-tor1-01.ssh > 198.96.85.163.2511: Flags [P.], seq 14492:14656, ack 1, win 313, length 164
20:15:50.153233 IP lamp-s-1vcpu-1gb-tor1-01.ssh > 198.96.85.163.2511: Flags [P.], seq 14656:14820, ack 1, win 313, length 164
20:15:50.153374 IP lamp-s-1vcpu-1gb-tor1-01.ssh > 198.96.85.163.2511: Flags [P.], seq 14820:14984, ack 1, win 313, length 164
20:15:50.153526 IP lamp-s-1vcpu-1gb-tor1-01.ssh > 198.96.85.163.2511: Flags [P.], seq 14984:15148, ack 1, win 313, length 164
20:15:50.153687 IP lamp-s-1vcpu-1gb-tor1-01.ssh > 198.96.85.163.2511: Flags [P.], seq 15148:15312, ack 1, win 313, length 164
20:15:50.153809 IP lamp-s-1vcpu-1gb-tor1-01.ssh > 198.96.85.163.2511: Flags [P.], seq 15312:15476, ack 1, win 313, length 164
20:15:50.153924 IP lamp-s-1vcpu-1gb-tor1-01.ssh > 198.96.85.163.2511: Flags [P.], seq 15476:15640, ack 1, win 313, length 164
20:15:50.154039 IP lamp-s-1vcpu-1gb-tor1-01.ssh > 198.96.85.163.2511: Flags [P.], seq 15640:15804, ack 1, win 313, length 164
20:15:50.154153 IP lamp-s-1vcpu-1gb-tor1-01.ssh > 198.96.85.163.2511: Flags [P.], seq 15804:15968, ack 1, win 313, length 164
20:15:50.154266 IP lamp-s-1vcpu-1gb-tor1-01.ssh > 198.96.85.163.2511: Flags [P.], seq 15968:16132, ack 1, win 313, length 164
20:15:50.154381 IP lamp-s-1vcpu-1gb-tor1-01.ssh > 198.96.85.163.2511: Flags [P.], seq 16132:16296, ack 1, win 313, length 164
20:15:50.154498 IP lamp-s-1vcpu-1gb-tor1-01.ssh > 198.96.85.163.2511: Flags [P.], seq 16296:16460, ack 1, win 313, length 164
20:15:50.154596 IP lamp-s-1vcpu-1gb-tor1-01.ssh > 198.96.85.163.2511: Flags [P.], seq 16460:16624, ack 1, win 313, length 164
20:15:50.154756 IP lamp-s-1vcpu-1gb-tor1-01.ssh > 198.96.85.163.2511: Flags [P.], seq 16624:16788, ack 1, win 313, length 164
20:15:50.154959 IP lamp-s-1vcpu-1gb-tor1-01.ssh > 198.96.85.163.2511: Flags [P.], seq 16788:16952, ack 1, win 313, length 164
20:15:50.155125 IP lamp-s-1vcpu-1gb-tor1-01.ssh > 198.96.85.163.2511: Flags [P.], seq 16952:17116, ack 1, win 313, length 164
20:15:50.155291 IP lamp-s-1vcpu-1gb-tor1-01.ssh > 198.96.85.163.2511: Flags [P.], seq 17116:17280, ack 1, win 313, length 164
20:15:50.155444 IP lamp-s-1vcpu-1gb-tor1-01.ssh > 198.96.85.163.2511: Flags [P.], seq 17280:17444, ack 1, win 313, length 164
20:15:50.155591 IP lamp-s-1vcpu-1gb-tor1-01.ssh > 198.96.85.163.2511: Flags [P.], seq 17444:17608, ack 1, win 313, length 164
20:15:50.155794 IP lamp-s-1vcpu-1gb-tor1-01.ssh > 198.96.85.163.2511: Flags [P.], seq 17608:17772, ack 1, win 313, length 164
20:15:50.155920 IP lamp-s-1vcpu-1gb-tor1-01.ssh > 198.96.85.163.2511: Flags [P.], seq 17772:17936, ack 1, win 313, length 164
20:15:50.156037 IP lamp-s-1vcpu-1gb-tor1-01.ssh > 198.96.85.163.2511: Flags [P.], seq 17936:18100, ack 1, win 313, length 164
20:15:50.156150 IP lamp-s-1vcpu-1gb-tor1-01.ssh > 198.96.85.163.2511: Flags [P.], seq 18100:18264, ack 1, win 313, length 164
20:15:50.156264 IP lamp-s-1vcpu-1gb-tor1-01.ssh > 198.96.85.163.2511: Flags [P.], seq 18264:18428, ack 1, win 313, length 164
20:15:50.156419 IP lamp-s-1vcpu-1gb-tor1-01.ssh > 198.96.85.163.2511: Flags [P.], seq 18428:18592, ack 1, win 313, length 164
20:15:50.156535 IP lamp-s-1vcpu-1gb-tor1-01.ssh > 198.96.85.163.2511: Flags [P.], seq 18592:18756, ack 1, win 313, length 164
20:15:50.156651 IP lamp-s-1vcpu-1gb-tor1-01.ssh > 198.96.85.163.2511: Flags [P.], seq 18756:18920, ack 1, win 313, length 164
20:15:50.156764 IP lamp-s-1vcpu-1gb-tor1-01.ssh > 198.96.85.163.2511: Flags [P.], seq 18920:19084, ack 1, win 313, length 164
20:15:50.156876 IP lamp-s-1vcpu-1gb-tor1-01.ssh > 198.96.85.163.2511: Flags [P.], seq 19084:19248, ack 1, win 313, length 164
20:15:50.156987 IP lamp-s-1vcpu-1gb-tor1-01.ssh > 198.96.85.163.2511: Flags [P.], seq 19248:19412, ack 1, win 313, length 164
20:15:50.157100 IP lamp-s-1vcpu-1gb-tor1-01.ssh > 198.96.85.163.2511: Flags [P.], seq 19412:19576, ack 1, win 313, length 164
20:15:50.157219 IP lamp-s-1vcpu-1gb-tor1-01.ssh > 198.96.85.163.2511: Flags [P.], seq 19576:19740, ack 1, win 313, length 164
20:15:50.157335 IP lamp-s-1vcpu-1gb-tor1-01.ssh > 198.96.85.163.2511: Flags [P.], seq 19740:19904, ack 1, win 313, length 164
20:15:50.157448 IP lamp-s-1vcpu-1gb-tor1-01.ssh > 198.96.85.163.2511: Flags [P.], seq 19904:20068, ack 1, win 313, length 164
20:15:50.157677 IP lamp-s-1vcpu-1gb-tor1-01.ssh > 198.96.85.163.2511: Flags [P.], seq 20068:20232, ack 1, win 313, length 164
20:15:50.157860 IP lamp-s-1vcpu-1gb-tor1-01.ssh > 198.96.85.163.2511: Flags [P.], seq 20232:20396, ack 1, win 313, length 164
20:15:50.157981 IP lamp-s-1vcpu-1gb-tor1-01.ssh > 198.96.85.163.2511: Flags [P.], seq 20396:20560, ack 1, win 313, length 164
20:15:50.158099 IP lamp-s-1vcpu-1gb-tor1-01.ssh > 198.96.85.163.2511: Flags [P.], seq 20560:20724, ack 1, win 313, length 164
20:15:50.158215 IP lamp-s-1vcpu-1gb-tor1-01.ssh > 198.96.85.163.2511: Flags [P.], seq 20724:20888, ack 1, win 313, length 164
20:15:50.158334 IP lamp-s-1vcpu-1gb-tor1-01.ssh > 198.96.85.163.2511: Flags [P.], seq 20888:21052, ack 1, win 313, length 164
20:15:50.158448 IP lamp-s-1vcpu-1gb-tor1-01.ssh > 198.96.85.163.2511: Flags [P.], seq 21052:21216, ack 1, win 313, length 164
20:15:50.158567 IP lamp-s-1vcpu-1gb-tor1-01.ssh > 198.96.85.163.2511: Flags [P.], seq 21216:21380, ack 1, win 313, length 164
20:15:50.158681 IP lamp-s-1vcpu-1gb-tor1-01.ssh > 198.96.85.163.2511: Flags [P.], seq 21380:21544, ack 1, win 313, length 164
20:15:50.158799 IP lamp-s-1vcpu-1gb-tor1-01.ssh > 198.96.85.163.2511: Flags [P.], seq 21544:21708, ack 1, win 313, length 164
20:15:50.158913 IP lamp-s-1vcpu-1gb-tor1-01.ssh > 198.96.85.163.2511: Flags [P.], seq 21708:21872, ack 1, win 313, length 164
20:15:50.159031 IP lamp-s-1vcpu-1gb-tor1-01.ssh > 198.96.85.163.2511: Flags [P.], seq 21872:22036, ack 1, win 313, length 164
20:15:50.159145 IP lamp-s-1vcpu-1gb-tor1-01.ssh > 198.96.85.163.2511: Flags [P.], seq 22036:22200, ack 1, win 313, length 164
20:15:50.159264 IP lamp-s-1vcpu-1gb-tor1-01.ssh > 198.96.85.163.2511: Flags [P.], seq 22200:22364, ack 1, win 313, length 164
20:15:50.159398 IP lamp-s-1vcpu-1gb-tor1-01.ssh > 198.96.85.163.2511: Flags [P.], seq 22364:22528, ack 1, win 313, length 164
20:15:50.159548 IP lamp-s-1vcpu-1gb-tor1-01.ssh > 198.96.85.163.2511: Flags [P.], seq 22528:22692, ack 1, win 313, length 164
20:15:50.159690 IP lamp-s-1vcpu-1gb-tor1-01.ssh > 198.96.85.163.2511: Flags [P.], seq 22692:22856, ack 1, win 313, length 164
20:15:50.159845 IP lamp-s-1vcpu-1gb-tor1-01.ssh > 198.96.85.163.2511: Flags [P.], seq 22856:23020, ack 1, win 313, length 164
20:15:50.159964 IP lamp-s-1vcpu-1gb-tor1-01.ssh > 198.96.85.163.2511: Flags [P.], seq 23020:23184, ack 1, win 313, length 164
20:15:50.160116 IP lamp-s-1vcpu-1gb-tor1-01.ssh > 198.96.85.163.2511: Flags [P.], seq 23184:23348, ack 1, win 313, length 164
20:15:50.160320 IP lamp-s-1vcpu-1gb-tor1-01.ssh > 198.96.85.163.2511: Flags [P.], seq 23348:23512, ack 1, win 313, length 164
20:15:50.160482 IP lamp-s-1vcpu-1gb-tor1-01.ssh > 198.96.85.163.2511: Flags [P.], seq 23512:23676, ack 1, win 313, length 164
20:15:50.160603 IP lamp-s-1vcpu-1gb-tor1-01.ssh > 198.96.85.163.2511: Flags [P.], seq 23676:23840, ack 1, win 313, length 164
20:15:50.160722 IP lamp-s-1vcpu-1gb-tor1-01.ssh > 198.96.85.163.2511: Flags [P.], seq 23840:24004, ack 1, win 313, length 164
20:15:50.160836 IP lamp-s-1vcpu-1gb-tor1-01.ssh > 198.96.85.163.2511: Flags [P.], seq 24004:24168, ack 1, win 313, length 164
20:15:50.160955 IP lamp-s-1vcpu-1gb-tor1-01.ssh > 198.96.85.163.2511: Flags [P.], seq 24168:24332, ack 1, win 313, length 164
20:15:50.161070 IP lamp-s-1vcpu-1gb-tor1-01.ssh > 198.96.85.163.2511: Flags [P.], seq 24332:24496, ack 1, win 313, length 164
20:15:50.161188 IP lamp-s-1vcpu-1gb-tor1-01.ssh > 198.96.85.163.2511: Flags [P.], seq 24496:24660, ack 1, win 313, length 164
20:15:50.161303 IP lamp-s-1vcpu-1gb-tor1-01.ssh > 198.96.85.163.2511: Flags [P.], seq 24660:24824, ack 1, win 313, length 164
20:15:50.161421 IP lamp-s-1vcpu-1gb-tor1-01.ssh > 198.96.85.163.2511: Flags [P.], seq 24824:24988, ack 1, win 313, length 164
20:15:50.161535 IP lamp-s-1vcpu-1gb-tor1-01.ssh > 198.96.85.163.2511: Flags [P.], seq 24988:25152, ack 1, win 313, length 164
20:15:50.161653 IP lamp-s-1vcpu-1gb-tor1-01.ssh > 198.96.85.163.2511: Flags [P.], seq 25152:25316, ack 1, win 313, length 164
20:15:50.161768 IP lamp-s-1vcpu-1gb-tor1-01.ssh > 198.96.85.163.2511: Flags [P.], seq 25316:25480, ack 1, win 313, length 164
20:15:50.161887 IP lamp-s-1vcpu-1gb-tor1-01.ssh > 198.96.85.163.2511: Flags [P.], seq 25480:25644, ack 1, win 313, length 164
20:15:50.162063 IP lamp-s-1vcpu-1gb-tor1-01.ssh > 198.96.85.163.2511: Flags [P.], seq 25644:25808, ack 1, win 313, length 164
20:15:50.162184 IP lamp-s-1vcpu-1gb-tor1-01.ssh > 198.96.85.163.2511: Flags [P.], seq 25808:25972, ack 1, win 313, length 164
20:15:50.162296 IP lamp-s-1vcpu-1gb-tor1-01.ssh > 198.96.85.163.2511: Flags [P.], seq 25972:26136, ack 1, win 313, length 164
20:15:50.162413 IP lamp-s-1vcpu-1gb-tor1-01.ssh > 198.96.85.163.2511: Flags [P.], seq 26136:26300, ack 1, win 313, length 164
20:15:50.162504 IP lamp-s-1vcpu-1gb-tor1-01.ssh > 198.96.85.163.2511: Flags [P.], seq 26300:26464, ack 1, win 313, length 164
20:15:50.162615 IP lamp-s-1vcpu-1gb-tor1-01.ssh > 198.96.85.163.2511: Flags [P.], seq 26464:26628, ack 1, win 313, length 164
20:15:50.162774 IP lamp-s-1vcpu-1gb-tor1-01.ssh > 198.96.85.163.2511: Flags [P.], seq 26628:26792, ack 1, win 313, length 164
20:15:50.162969 IP lamp-s-1vcpu-1gb-tor1-01.ssh > 198.96.85.163.2511: Flags [P.], seq 26792:26956, ack 1, win 313, length 164
20:15:50.163105 IP lamp-s-1vcpu-1gb-tor1-01.ssh > 198.96.85.163.2511: Flags [P.], seq 26956:27120, ack 1, win 313, length 164
20:15:50.163221 IP lamp-s-1vcpu-1gb-tor1-01.ssh > 198.96.85.163.2511: Flags [P.], seq 27120:27284, ack 1, win 313, length 164
20:15:50.163333 IP lamp-s-1vcpu-1gb-tor1-01.ssh > 198.96.85.163.2511: Flags [P.], seq 27284:27448, ack 1, win 313, length 164
20:15:50.163447 IP lamp-s-1vcpu-1gb-tor1-01.ssh > 198.96.85.163.2511: Flags [P.], seq 27448:27612, ack 1, win 313, length 164
20:15:50.163559 IP lamp-s-1vcpu-1gb-tor1-01.ssh > 198.96.85.163.2511: Flags [P.], seq 27612:27776, ack 1, win 313, length 164
20:15:50.163670 IP lamp-s-1vcpu-1gb-tor1-01.ssh > 198.96.85.163.2511: Flags [P.], seq 27776:27940, ack 1, win 313, length 164
20:15:50.163823 IP lamp-s-1vcpu-1gb-tor1-01.ssh > 198.96.85.163.2511: Flags [P.], seq 27940:28104, ack 1, win 313, length 164
20:15:50.163948 IP lamp-s-1vcpu-1gb-tor1-01.ssh > 198.96.85.163.2511: Flags [P.], seq 28104:28268, ack 1, win 313, length 164
20:15:50.164063 IP lamp-s-1vcpu-1gb-tor1-01.ssh > 198.96.85.163.2511: Flags [P.], seq 28268:28432, ack 1, win 313, length 164
20:15:50.164182 IP lamp-s-1vcpu-1gb-tor1-01.ssh > 198.96.85.163.2511: Flags [P.], seq 28432:28596, ack 1, win 313, length 164
20:15:50.164297 IP lamp-s-1vcpu-1gb-tor1-01.ssh > 198.96.85.163.2511: Flags [P.], seq 28596:28760, ack 1, win 313, length 164
20:15:50.164439 IP lamp-s-1vcpu-1gb-tor1-01.ssh > 198.96.85.163.2511: Flags [P.], seq 28760:28924, ack 1, win 313, length 164
20:15:50.164560 IP lamp-s-1vcpu-1gb-tor1-01.ssh > 198.96.85.163.2511: Flags [P.], seq 28924:29088, ack 1, win 313, length 164
20:15:50.164679 IP lamp-s-1vcpu-1gb-tor1-01.ssh > 198.96.85.163.2511: Flags [P.], seq 29088:29252, ack 1, win 313, length 164
20:15:50.164826 IP lamp-s-1vcpu-1gb-tor1-01.ssh > 198.96.85.163.2511: Flags [P.], seq 29252:29416, ack 1, win 313, length 164
20:15:50.165044 IP lamp-s-1vcpu-1gb-tor1-01.ssh > 198.96.85.163.2511: Flags [P.], seq 29416:29580, ack 1, win 313, length 164
20:15:50.165185 IP lamp-s-1vcpu-1gb-tor1-01.ssh > 198.96.85.163.2511: Flags [P.], seq 29580:29744, ack 1, win 313, length 164
20:15:50.165428 IP lamp-s-1vcpu-1gb-tor1-01.ssh > 198.96.85.163.2511: Flags [P.], seq 29744:29908, ack 1, win 313, length 164
20:15:50.165569 IP lamp-s-1vcpu-1gb-tor1-01.ssh > 198.96.85.163.2511: Flags [P.], seq 29908:30072, ack 1, win 313, length 164
20:15:50.165692 IP lamp-s-1vcpu-1gb-tor1-01.ssh > 198.96.85.163.2511: Flags [P.], seq 30072:30236, ack 1, win 313, length 164
20:15:50.165807 IP lamp-s-1vcpu-1gb-tor1-01.ssh > 198.96.85.163.2511: Flags [P.], seq 30236:30400, ack 1, win 313, length 164
20:15:50.165926 IP lamp-s-1vcpu-1gb-tor1-01.ssh > 198.96.85.163.2511: Flags [P.], seq 30400:30564, ack 1, win 313, length 164
20:15:50.166040 IP lamp-s-1vcpu-1gb-tor1-01.ssh > 198.96.85.163.2511: Flags [P.], seq 30564:30728, ack 1, win 313, length 164
20:15:50.166159 IP lamp-s-1vcpu-1gb-tor1-01.ssh > 198.96.85.163.2511: Flags [P.], seq 30728:30892, ack 1, win 313, length 164
20:15:50.166273 IP lamp-s-1vcpu-1gb-tor1-01.ssh > 198.96.85.163.2511: Flags [P.], seq 30892:31056, ack 1, win 313, length 164
20:15:50.166414 IP lamp-s-1vcpu-1gb-tor1-01.ssh > 198.96.85.163.2511: Flags [P.], seq 31056:31220, ack 1, win 313, length 164
20:15:50.166532 IP lamp-s-1vcpu-1gb-tor1-01.ssh > 198.96.85.163.2511: Flags [P.], seq 31220:31384, ack 1, win 313, length 164
20:15:50.166658 IP lamp-s-1vcpu-1gb-tor1-01.ssh > 198.96.85.163.2511: Flags [P.], seq 31384:31548, ack 1, win 313, length 164
20:15:50.166787 IP lamp-s-1vcpu-1gb-tor1-01.ssh > 198.96.85.163.2511: Flags [P.], seq 31548:31712, ack 1, win 313, length 164
20:15:50.166912 IP lamp-s-1vcpu-1gb-tor1-01.ssh > 198.96.85.163.2511: Flags [P.], seq 31712:31876, ack 1, win 313, length 164
20:15:50.167041 IP lamp-s-1vcpu-1gb-tor1-01.ssh > 198.96.85.163.2511: Flags [P.], seq 31876:32040, ack 1, win 313, length 164
20:15:50.167167 IP lamp-s-1vcpu-1gb-tor1-01.ssh > 198.96.85.163.2511: Flags [P.], seq 32040:32204, ack 1, win 313, length 164
20:15:50.167283 IP lamp-s-1vcpu-1gb-tor1-01.ssh > 198.96.85.163.2511: Flags [P.], seq 32204:32368, ack 1, win 313, length 164
20:15:50.167504 IP lamp-s-1vcpu-1gb-tor1-01.ssh > 198.96.85.163.2511: Flags [P.], seq 32368:32532, ack 1, win 313, length 164
20:15:50.167643 IP lamp-s-1vcpu-1gb-tor1-01.ssh > 198.96.85.163.2511: Flags [P.], seq 32532:32696, ack 1, win 313, length 164
20:15:50.167804 IP lamp-s-1vcpu-1gb-tor1-01.ssh > 198.96.85.163.2511: Flags [P.], seq 32696:32860, ack 1, win 313, length 164
20:15:50.167928 IP lamp-s-1vcpu-1gb-tor1-01.ssh > 198.96.85.163.2511: Flags [P.], seq 32860:33024, ack 1, win 313, length 164
20:15:50.168049 IP lamp-s-1vcpu-1gb-tor1-01.ssh > 198.96.85.163.2511: Flags [P.], seq 33024:33188, ack 1, win 313, length 164
20:15:50.168164 IP lamp-s-1vcpu-1gb-tor1-01.ssh > 198.96.85.163.2511: Flags [P.], seq 33188:33352, ack 1, win 313, length 164
20:15:50.168284 IP lamp-s-1vcpu-1gb-tor1-01.ssh > 198.96.85.163.2511: Flags [P.], seq 33352:33516, ack 1, win 313, length 164
20:15:50.168458 IP lamp-s-1vcpu-1gb-tor1-01.ssh > 198.96.85.163.2511: Flags [P.], seq 33516:33680, ack 1, win 313, length 164
20:15:50.168646 IP lamp-s-1vcpu-1gb-tor1-01.ssh > 198.96.85.163.2511: Flags [P.], seq 33680:33844, ack 1, win 313, length 164
20:15:50.168777 IP lamp-s-1vcpu-1gb-tor1-01.ssh > 198.96.85.163.2511: Flags [P.], seq 33844:34008, ack 1, win 313, length 164
20:15:50.168900 IP lamp-s-1vcpu-1gb-tor1-01.ssh > 198.96.85.163.2511: Flags [P.], seq 34008:34172, ack 1, win 313, length 164
20:15:50.169018 IP lamp-s-1vcpu-1gb-tor1-01.ssh > 198.96.85.163.2511: Flags [P.], seq 34172:34336, ack 1, win 313, length 164
20:15:50.169138 IP lamp-s-1vcpu-1gb-tor1-01.ssh > 198.96.85.163.2511: Flags [P.], seq 34336:34500, ack 1, win 313, length 164
20:15:50.169255 IP lamp-s-1vcpu-1gb-tor1-01.ssh > 198.96.85.163.2511: Flags [P.], seq 34500:34664, ack 1, win 313, length 164
20:15:50.169375 IP lamp-s-1vcpu-1gb-tor1-01.ssh > 198.96.85.163.2511: Flags [P.], seq 34664:34828, ack 1, win 313, length 164
20:15:50.169490 IP lamp-s-1vcpu-1gb-tor1-01.ssh > 198.96.85.163.2511: Flags [P.], seq 34828:34992, ack 1, win 313, length 164
20:15:50.169615 IP lamp-s-1vcpu-1gb-tor1-01.ssh > 198.96.85.163.2511: Flags [P.], seq 34992:35156, ack 1, win 313, length 164
20:15:50.169734 IP lamp-s-1vcpu-1gb-tor1-01.ssh > 198.96.85.163.2511: Flags [P.], seq 35156:35320, ack 1, win 313, length 164
20:15:50.169913 IP lamp-s-1vcpu-1gb-tor1-01.ssh > 198.96.85.163.2511: Flags [P.], seq 35320:35484, ack 1, win 313, length 164
20:15:50.170039 IP lamp-s-1vcpu-1gb-tor1-01.ssh > 198.96.85.163.2511: Flags [P.], seq 35484:35648, ack 1, win 313, length 164
20:15:50.170166 IP lamp-s-1vcpu-1gb-tor1-01.ssh > 198.96.85.163.2511: Flags [P.], seq 35648:35812, ack 1, win 313, length 164
20:15:50.170283 IP lamp-s-1vcpu-1gb-tor1-01.ssh > 198.96.85.163.2511: Flags [P.], seq 35812:35976, ack 1, win 313, length 164
20:15:50.170404 IP lamp-s-1vcpu-1gb-tor1-01.ssh > 198.96.85.163.2511: Flags [P.], seq 35976:36140, ack 1, win 313, length 164
20:15:50.170519 IP lamp-s-1vcpu-1gb-tor1-01.ssh > 198.96.85.163.2511: Flags [P.], seq 36140:36304, ack 1, win 313, length 164
20:15:50.170639 IP lamp-s-1vcpu-1gb-tor1-01.ssh > 198.96.85.163.2511: Flags [P.], seq 36304:36468, ack 1, win 313, length 164
20:15:50.170756 IP lamp-s-1vcpu-1gb-tor1-01.ssh > 198.96.85.163.2511: Flags [P.], seq 36468:36632, ack 1, win 313, length 164
20:15:50.170877 IP lamp-s-1vcpu-1gb-tor1-01.ssh > 198.96.85.163.2511: Flags [P.], seq 36632:36796, ack 1, win 313, length 164
20:15:50.170993 IP lamp-s-1vcpu-1gb-tor1-01.ssh > 198.96.85.163.2511: Flags [P.], seq 36796:36960, ack 1, win 313, length 164
20:15:50.171113 IP lamp-s-1vcpu-1gb-tor1-01.ssh > 198.96.85.163.2511: Flags [P.], seq 36960:37124, ack 1, win 313, length 164
20:15:50.171233 IP lamp-s-1vcpu-1gb-tor1-01.ssh > 198.96.85.163.2511: Flags [P.], seq 37124:37288, ack 1, win 313, length 164
20:15:50.171354 IP lamp-s-1vcpu-1gb-tor1-01.ssh > 198.96.85.163.2511: Flags [P.], seq 37288:37452, ack 1, win 313, length 164
20:15:50.171511 IP lamp-s-1vcpu-1gb-tor1-01.ssh > 198.96.85.163.2511: Flags [P.], seq 37452:37616, ack 1, win 313, length 164
20:15:50.171656 IP lamp-s-1vcpu-1gb-tor1-01.ssh > 198.96.85.163.2511: Flags [P.], seq 37616:37780, ack 1, win 313, length 164
20:15:50.171861 IP lamp-s-1vcpu-1gb-tor1-01.ssh > 198.96.85.163.2511: Flags [P.], seq 37780:37944, ack 1, win 313, length 164
20:15:50.171992 IP lamp-s-1vcpu-1gb-tor1-01.ssh > 198.96.85.163.2511: Flags [P.], seq 37944:38108, ack 1, win 313, length 164
20:15:50.172109 IP lamp-s-1vcpu-1gb-tor1-01.ssh > 198.96.85.163.2511: Flags [P.], seq 38108:38272, ack 1, win 313, length 164
20:15:50.172223 IP lamp-s-1vcpu-1gb-tor1-01.ssh > 198.96.85.163.2511: Flags [P.], seq 38272:38436, ack 1, win 313, length 164
20:15:50.172336 IP lamp-s-1vcpu-1gb-tor1-01.ssh > 198.96.85.163.2511: Flags [P.], seq 38436:38600, ack 1, win 313, length 164
20:15:50.172472 IP lamp-s-1vcpu-1gb-tor1-01.ssh > 198.96.85.163.2511: Flags [P.], seq 38600:38764, ack 1, win 313, length 164
20:15:50.172588 IP lamp-s-1vcpu-1gb-tor1-01.ssh > 198.96.85.163.2511: Flags [P.], seq 38764:38928, ack 1, win 313, length 164
20:15:50.172701 IP lamp-s-1vcpu-1gb-tor1-01.ssh > 198.96.85.163.2511: Flags [P.], seq 38928:39092, ack 1, win 313, length 164
20:15:50.172815 IP lamp-s-1vcpu-1gb-tor1-01.ssh > 198.96.85.163.2511: Flags [P.], seq 39092:39256, ack 1, win 313, length 164
20:15:50.172928 IP lamp-s-1vcpu-1gb-tor1-01.ssh > 198.96.85.163.2511: Flags [P.], seq 39256:39420, ack 1, win 313, length 164
20:15:50.173048 IP lamp-s-1vcpu-1gb-tor1-01.ssh > 198.96.85.163.2511: Flags [P.], seq 39420:39584, ack 1, win 313, length 164
20:15:50.173162 IP lamp-s-1vcpu-1gb-tor1-01.ssh > 198.96.85.163.2511: Flags [P.], seq 39584:39748, ack 1, win 313, length 164
20:15:50.173277 IP lamp-s-1vcpu-1gb-tor1-01.ssh > 198.96.85.163.2511: Flags [P.], seq 39748:39912, ack 1, win 313, length 164
20:15:50.173390 IP lamp-s-1vcpu-1gb-tor1-01.ssh > 198.96.85.163.2511: Flags [P.], seq 39912:40076, ack 1, win 313, length 164
20:15:50.173502 IP lamp-s-1vcpu-1gb-tor1-01.ssh > 198.96.85.163.2511: Flags [P.], seq 40076:40240, ack 1, win 313, length 164
20:15:50.173616 IP lamp-s-1vcpu-1gb-tor1-01.ssh > 198.96.85.163.2511: Flags [P.], seq 40240:40404, ack 1, win 313, length 164
20:15:50.173728 IP lamp-s-1vcpu-1gb-tor1-01.ssh > 198.96.85.163.2511: Flags [P.], seq 40404:40568, ack 1, win 313, length 164
20:15:50.173842 IP lamp-s-1vcpu-1gb-tor1-01.ssh > 198.96.85.163.2511: Flags [P.], seq 40568:40732, ack 1, win 313, length 164
20:15:50.173956 IP lamp-s-1vcpu-1gb-tor1-01.ssh > 198.96.85.163.2511: Flags [P.], seq 40732:40896, ack 1, win 313, length 164
20:15:50.174070 IP lamp-s-1vcpu-1gb-tor1-01.ssh > 198.96.85.163.2511: Flags [P.], seq 40896:41060, ack 1, win 313, length 164
20:15:50.174184 IP lamp-s-1vcpu-1gb-tor1-01.ssh > 198.96.85.163.2511: Flags [P.], seq 41060:41224, ack 1, win 313, length 164
20:15:50.174303 IP lamp-s-1vcpu-1gb-tor1-01.ssh > 198.96.85.163.2511: Flags [P.], seq 41224:41388, ack 1, win 313, length 164
20:15:50.174418 IP lamp-s-1vcpu-1gb-tor1-01.ssh > 198.96.85.163.2511: Flags [P.], seq 41388:41552, ack 1, win 313, length 164
20:15:50.174557 IP lamp-s-1vcpu-1gb-tor1-01.ssh > 198.96.85.163.2511: Flags [P.], seq 41552:41716, ack 1, win 313, length 164
20:15:50.174681 IP lamp-s-1vcpu-1gb-tor1-01.ssh > 198.96.85.163.2511: Flags [P.], seq 41716:41880, ack 1, win 313, length 164
^C
249 packets captured
250 packets received by filter
1 packet dropped by kernel
