root@lamp-s-1vcpu-1gb-tor1-01:~# tcpdump -c 5 -i eth0
tcpdump: verbose output suppressed, use -v or -vv for full protocol decode
listening on eth0, link-type EN10MB (Ethernet), capture size 262144 bytes
18:41:18.915321 IP lamp-s-1vcpu-1gb-tor1-01.ssh > 198.96.85.163.64793: Flags [P.], seq 1387884188:1387884296, ack 2096598328, win 292, length 108
18:41:18.915432 IP lamp-s-1vcpu-1gb-tor1-01.ssh > 198.96.85.163.64793: Flags [P.], seq 108:144, ack 1, win 292, length 36
18:41:18.915538 IP lamp-s-1vcpu-1gb-tor1-01.ssh > 198.96.85.163.64793: Flags [P.], seq 144:252, ack 1, win 292, length 108
18:41:18.915621 IP lamp-s-1vcpu-1gb-tor1-01.ssh > 198.96.85.163.64793: Flags [P.], seq 252:288, ack 1, win 292, length 36
18:41:18.917804 IP lamp-s-1vcpu-1gb-tor1-01.ssh > 198.96.85.163.64793: Flags [P.], seq 288:468, ack 1, win 292, length 180
5 packets captured
9 packets received by filter
0 packets dropped by kernel
